{
  "generatedBy": "stub",
  "generatedAt": "2026-07-10T05:02:54.668Z",
  "count": 82,
  "photos": [
    {
      "file": "input/001.jpg",
      "orient": "portrait",
      "tags": [],
      "emotion": "calm",
      "heroScore": 0.419,
      "emotionScore": 0.5,
      "storyImportance": 0.5,
      "source": "stub",
      "quality": 41.912,
      "sharpness": 44.392,
      "meanLuma": 113.7,
      "focusX": 0.536,
      "focusY": 0.519
    },
    {
      "file": "input/002.jpg",
      "orient": "landscape",
      "tags": [],
      "emotion": "calm",
      "heroScore": 0.303,
      "emotionScore": 0.5,
      "storyImportance": 0.5,
      "source": "stub",
      "quality": 30.26,
      "sharpness": 32.415,
      "meanLuma": 111,
      "focusX": 0.61,
      "focusY": 0.606
    },
    {
      "file": "input/003.jpg",
      "orient": "portrait",
      "tags": [],
      "emotion": "calm",
      "heroScore": 0.282,
      "emotionScore": 0.5,
      "storyImportance": 0.5,
      "source": "stub",
      "quality": 28.213,
      "sharpness": 28.725,
      "meanLuma": 123.4,
      "focusX": 0.516,
      "focusY": 0.612
    },
    {
      "file": "input/004.jpg",
      "orient": "landscape",
      "tags": [],
      "emotion": "calm",
      "heroScore": 0.328,
      "emotionScore": 0.5,
      "storyImportance": 0.5,
      "source": "stub",
      "quality": 32.762,
      "sharpness": 33.532,
      "meanLuma": 133.9,
      "focusX": 0.404,
      "focusY": 0.459
    },
    {
      "file": "input/005.jpg",
      "orient": "portrait",
      "tags": [],
      "emotion": "calm",
      "heroScore": 0.292,
      "emotionScore": 0.5,
      "storyImportance": 0.5,
      "source": "stub",
      "quality": 29.164,
      "sharpness": 29.534,
      "meanLuma": 131.2,
      "focusX": 0.428,
      "focusY": 0.704
    },
    {
      "file": "input/006.jpg",
      "orient": "landscape",
      "tags": [],
      "emotion": "calm",
      "heroScore": 0.26,
      "emotionScore": 0.5,
      "storyImportance": 0.5,
      "source": "stub",
      "quality": 26.01,
      "sharpness": 26.265,
      "meanLuma": 125.5,
      "focusX": 0.355,
      "focusY": 0.4
    },
    {
      "file": "input/007.jpg",
      "orient": "portrait",
      "tags": [],
      "emotion": "calm",
      "heroScore": 0.274,
      "emotionScore": 0.5,
      "storyImportance": 0.5,
      "source": "stub",
      "quality": 27.409,
      "sharpness": 27.772,
      "meanLuma": 124.7,
      "focusX": 0.474,
      "focusY": 0.556
    },
    {
      "file": "input/008.jpg",
      "orient": "landscape",
      "tags": [],
      "emotion": "calm",
      "heroScore": 0.379,
      "emotionScore": 0.5,
      "storyImportance": 0.5,
      "source": "stub",
      "quality": 37.91,
      "sharpness": 40.389,
      "meanLuma": 143.7,
      "focusX": 0.518,
      "focusY": 0.499
    },
    {
      "file": "input/009.jpg",
      "orient": "portrait",
      "tags": [],
      "emotion": "calm",
      "heroScore": 0.214,
      "emotionScore": 0.5,
      "storyImportance": 0.5,
      "source": "stub",
      "quality": 21.392,
      "sharpness": 21.48,
      "meanLuma": 129.1,
      "focusX": 0.518,
      "focusY": 0.256
    },
    {
      "file": "input/010.jpg",
      "orient": "landscape",
      "tags": [],
      "emotion": "calm",
      "heroScore": 0.346,
      "emotionScore": 0.5,
      "storyImportance": 0.5,
      "source": "stub",
      "quality": 34.557,
      "sharpness": 36.111,
      "meanLuma": 139,
      "focusX": 0.495,
      "focusY": 0.547
    },
    {
      "file": "input/012.jpg",
      "orient": "portrait",
      "tags": [],
      "emotion": "calm",
      "heroScore": 0.325,
      "emotionScore": 0.5,
      "storyImportance": 0.5,
      "source": "stub",
      "quality": 32.46,
      "sharpness": 35.328,
      "meanLuma": 148.8,
      "focusX": 0.377,
      "focusY": 0.599
    },
    {
      "file": "input/013.jpg",
      "orient": "portrait",
      "tags": [],
      "emotion": "calm",
      "heroScore": 0.284,
      "emotionScore": 0.5,
      "storyImportance": 0.5,
      "source": "stub",
      "quality": 28.368,
      "sharpness": 28.611,
      "meanLuma": 125.8,
      "focusX": 0.456,
      "focusY": 0.416
    },
    {
      "file": "input/014.jpg",
      "orient": "landscape",
      "tags": [],
      "emotion": "calm",
      "heroScore": 0.19,
      "emotionScore": 0.5,
      "storyImportance": 0.5,
      "source": "stub",
      "quality": 19.014,
      "sharpness": 23.079,
      "meanLuma": 173.1,
      "focusX": 0.595,
      "focusY": 0.498
    },
    {
      "file": "input/015.jpg",
      "orient": "landscape",
      "tags": [],
      "emotion": "calm",
      "heroScore": 0.303,
      "emotionScore": 0.5,
      "storyImportance": 0.5,
      "source": "stub",
      "quality": 30.297,
      "sharpness": 30.525,
      "meanLuma": 126.1,
      "focusX": 0.431,
      "focusY": 0.488
    },
    {
      "file": "input/016.jpg",
      "orient": "landscape",
      "tags": [],
      "emotion": "calm",
      "heroScore": 0.193,
      "emotionScore": 0.5,
      "storyImportance": 0.5,
      "source": "stub",
      "quality": 19.305,
      "sharpness": 23.957,
      "meanLuma": 78.3,
      "focusX": 0.435,
      "focusY": 0.219
    },
    {
      "file": "input/017.jpg",
      "orient": "landscape",
      "tags": [],
      "emotion": "calm",
      "heroScore": 0.159,
      "emotionScore": 0.5,
      "storyImportance": 0.5,
      "source": "stub",
      "quality": 15.873,
      "sharpness": 16.689,
      "meanLuma": 140.5,
      "focusX": 0.387,
      "focusY": 0.689
    },
    {
      "file": "input/018.jpg",
      "orient": "landscape",
      "tags": [],
      "emotion": "calm",
      "heroScore": 0.3,
      "emotionScore": 0.5,
      "storyImportance": 0.5,
      "source": "stub",
      "quality": 30.028,
      "sharpness": 30.388,
      "meanLuma": 125,
      "focusX": 0.639,
      "focusY": 0.596
    },
    {
      "file": "input/019.jpg",
      "orient": "landscape",
      "tags": [],
      "emotion": "calm",
      "heroScore": 0.219,
      "emotionScore": 0.5,
      "storyImportance": 0.5,
      "source": "stub",
      "quality": 21.88,
      "sharpness": 23.917,
      "meanLuma": 149.8,
      "focusX": 0.612,
      "focusY": 0.609
    },
    {
      "file": "input/020.jpg",
      "orient": "landscape",
      "tags": [],
      "emotion": "calm",
      "heroScore": 0.252,
      "emotionScore": 0.5,
      "storyImportance": 0.5,
      "source": "stub",
      "quality": 25.242,
      "sharpness": 25.92,
      "meanLuma": 134.7,
      "focusX": 0.666,
      "focusY": 0.642
    },
    {
      "file": "input/021.jpg",
      "orient": "landscape",
      "tags": [],
      "emotion": "calm",
      "heroScore": 0.219,
      "emotionScore": 0.5,
      "storyImportance": 0.5,
      "source": "stub",
      "quality": 21.867,
      "sharpness": 24.475,
      "meanLuma": 155.3,
      "focusX": 0.421,
      "focusY": 0.561
    },
    {
      "file": "input/022.jpg",
      "orient": "landscape",
      "tags": [],
      "emotion": "calm",
      "heroScore": 0.29,
      "emotionScore": 0.5,
      "storyImportance": 0.5,
      "source": "stub",
      "quality": 28.975,
      "sharpness": 32.379,
      "meanLuma": 101.1,
      "focusX": 0.63,
      "focusY": 0.575
    },
    {
      "file": "input/023.jpg",
      "orient": "portrait",
      "tags": [],
      "emotion": "calm",
      "heroScore": 0.234,
      "emotionScore": 0.5,
      "storyImportance": 0.5,
      "source": "stub",
      "quality": 23.351,
      "sharpness": 24.52,
      "meanLuma": 140.2,
      "focusX": 0.479,
      "focusY": 0.545
    },
    {
      "file": "input/024.jpg",
      "orient": "portrait",
      "tags": [],
      "emotion": "calm",
      "heroScore": 0.234,
      "emotionScore": 0.5,
      "storyImportance": 0.5,
      "source": "stub",
      "quality": 23.351,
      "sharpness": 24.52,
      "meanLuma": 140.2,
      "focusX": 0.479,
      "focusY": 0.545
    },
    {
      "file": "input/025.jpg",
      "orient": "landscape",
      "tags": [],
      "emotion": "calm",
      "heroScore": 0.228,
      "emotionScore": 0.5,
      "storyImportance": 0.5,
      "source": "stub",
      "quality": 22.754,
      "sharpness": 25.675,
      "meanLuma": 157.1,
      "focusX": 0.649,
      "focusY": 0.459
    },
    {
      "file": "input/026.jpg",
      "orient": "portrait",
      "tags": [],
      "emotion": "calm",
      "heroScore": 0.208,
      "emotionScore": 0.5,
      "storyImportance": 0.5,
      "source": "stub",
      "quality": 20.775,
      "sharpness": 21.338,
      "meanLuma": 134.8,
      "focusX": 0.559,
      "focusY": 0.663
    },
    {
      "file": "input/027.jpg",
      "orient": "landscape",
      "tags": [],
      "emotion": "calm",
      "heroScore": 0.225,
      "emotionScore": 0.5,
      "storyImportance": 0.5,
      "source": "stub",
      "quality": 22.485,
      "sharpness": 23.68,
      "meanLuma": 140.9,
      "focusX": 0.538,
      "focusY": 0.7
    },
    {
      "file": "input/028.jpg",
      "orient": "landscape",
      "tags": [],
      "emotion": "calm",
      "heroScore": 0.266,
      "emotionScore": 0.5,
      "storyImportance": 0.5,
      "source": "stub",
      "quality": 26.621,
      "sharpness": 29.516,
      "meanLuma": 153.1,
      "focusX": 0.657,
      "focusY": 0.512
    },
    {
      "file": "input/029.jpg",
      "orient": "landscape",
      "tags": [],
      "emotion": "calm",
      "heroScore": 0.328,
      "emotionScore": 0.5,
      "storyImportance": 0.5,
      "source": "stub",
      "quality": 32.792,
      "sharpness": 33.172,
      "meanLuma": 130.9,
      "focusX": 0.616,
      "focusY": 0.463
    },
    {
      "file": "input/030.jpg",
      "orient": "landscape",
      "tags": [],
      "emotion": "calm",
      "heroScore": 0.34,
      "emotionScore": 0.5,
      "storyImportance": 0.5,
      "source": "stub",
      "quality": 33.976,
      "sharpness": 35.109,